{
  "mode": "standard",
  "classification": {
    "purpose": "explainer",
    "channel": "internal",
    "risk": "internal_low",
    "complexity": "standard",
    "audience_shape": "single"
  },
  "paper_type": "explainer",
  "default_length": {
    "newsletter": "800-1200 words",
    "blog": "1200-1800 words",
    "memo": "600-1000 words",
    "update": "150-300 words",
    "position_paper": "1800-3000 words",
    "white_paper": "3000-6000 words"
  },
  "citation_style": "inline_links",
  "research": {
    "web_allowed": true,
    "require_source_table": true,
    "flag_unsupported_claims": true
  },
  "review": {
    "audience_fit": true,
    "opposition_review": true,
    "fact_check": true,
    "persona_consistency": true,
    "external_models": {}
  }
}
